Variable,Original,Translation
neurovisualdisruption|psi.k,"You disappear from the sight of the target, removing its ability to detect for {0} and immediately entering stealth. Target also has its perception reduced by {1} and detection by {2}% for {3}.\n\nInvoking this ability immediately drains all your remaining action and movement points. Does not work on machines or true-sighted creatures. Can only be invoked in combat.","Desapareces de la vista del objetivo, eliminando su capacidad de detección durante {0} e entrando inmediatamente en sigilo. El objetivo también tiene su percepción reducida en {1} y la detección en {2}% durante {3}.\n\nInvocar esta habilidad drena inmediatamente todos tus puntos de acción y movimiento restantes. No funciona en máquinas o criaturas con vista verdadera. Solo se puede invocar en combate."
neurovisualdisruption|statuseffects.k,Cannot detect stealthed characters.,No puede detectar personajes en sigilo.
electrokineticimprint,"Generates an electrokinetic imprint at the target location that deals {0} damage to the first character that steps on it and stuns it for {1}. If you try to place the imprint on top of a trap, it will backfire. You can only have one imprint active at a time.","Genera una impronta electroquinética en la ubicación objetivo que inflige {0} de daño al primer personaje que la pisa y lo aturde durante {1}. Si intentas colocar la impronta encima de una trampa, fallará. Solo puedes tener una impronta activa a la vez."
implosion,"Deals mechanical damage equal to {0}% of target's current health. This attack bypasses damage thresholds and shields, but cannot critically hit.","Inflige daño mecánico igual al {0}% de la salud actual del objetivo. Este ataque ignora los umbrales de daño y los escudos, pero no puede asestar golpes críticos."
disruptivefield|psi.k,Creates a disruptive field around the target that reduces their chance to hit with ranged and thrown weapons by {0}% for {1}.,Crea un campo disruptivo alrededor del objetivo que reduce su probabilidad de golpear con armas a distancia y arrojadizas en un {0}% durante {1}.
disruptivefield|statuseffects.k,Chance to hit with ranged and thrown weapon reduced by {0}%.,Probabilidad de golpear con armas a distancia y arrojadizas reducida en un {0}%.
cryokineticorb,"You launch a large frozen orb which shatters on impact, sending ice shards flying in all directions. Each shard deals {0} and {1} damage and chills the target. \n\nChilled characters have their movement points decreased by {2} for {3}. This effect stacks {4} times.\n\nDue to shards fanning out, targets closer to the place of impact may be hit by multiple shards, while those farther away might not be hit at all.\n\nEach shard has {5}% chance to inflict a bleeding wound that does additional {6}% of the original mechanical damage done over {7}.","Lanzas un gran orbe congelado que se hace añicos al impactar, enviando esquirlas de hielo volando en todas direcciones. Cada esquirla inflige {0} y {1} de daño y enfría al objetivo.\n\nLos personajes enfriados tienen sus puntos de movimiento disminuidos en {2} durante {3}. Este efecto se acumula {4} veces.\n\nDebido a que las esquirlas se dispersan, los objetivos más cercanos al lugar del impacto pueden ser alcanzados por múltiples esquirlas, mientras que los más alejados podrían no ser alcanzados en absoluto.\n\nCada esquirla tiene un {5}% de probabilidad de infligir una herida sangrante que inflige un {6}% adicional del daño mecánico original infligido durante {7}."
exothermicaura|psi.k,"Makes you immune to heat damage and generates flames around you and in your wake. Lasts {0}, but the flames won't be generated on the last turn.\n\nCreatures standing in the fire suffer heat damage equal to {1}%-{2}% of their maximal health (up to maximum of {3}-{4}), plus additional {5}-{6}, depending on the intensity of fire at that spot, while creatures moving through the fire suffer one third of that damage per tile.","Te hace inmune al daño térmico y genera llamas a tu alrededor y a tu paso. Dura {0}, pero las llamas no se generarán en el último turno.\n\nLas criaturas que se encuentren en el fuego sufren daño térmico igual al {1}%-{2}% de su salud máxima (hasta un máximo de {3}-{4}), más {5}-{6} adicionales, dependiendo de la intensidad del fuego en ese punto, mientras que las criaturas que se muevan a través del fuego sufren un tercio de ese daño por casilla."
exothermicaura|statuseffects.k,You are immune to heat damage and generate flames around you and in your wake (except on the last turn).,Eres inmune al daño térmico y generas llamas a tu alrededor y a tu paso (excepto en el último turno).
cryoshield|psi.k,"Creates {0} frozen shards around the invoker. Each time the character suffers a melee attack, there's a {1}% chance that one of the shards will block {2} of mechanical damage and be destroyed in the process. Lasts {3} or until all shards are destroyed.","Crea {0} esquirlas congeladas alrededor del invocador. Cada vez que el personaje sufre un ataque cuerpo a cuerpo, hay un {1}% de probabilidad de que una de las esquirlas bloquee {2} de daño mecánico y sea destruida en el proceso. Dura {3} o hasta que todas las esquirlas sean destruidas."
cryoshield|statuseffects.k,"Each time the character suffers a melee attack, there's a {0}% chance that one of the shards will block {1} of mechanical damage and be destroyed in the process.","Cada vez que el personaje sufre un ataque cuerpo a cuerpo, hay un {0}% de probabilidad de que una de las esquirlas bloquee {1} de daño mecánico y sea destruida en el proceso."
temporaldistorsion-old,"Places a debuff on the target that lasts {0} and deals {1} and {2} damage when it expires. In the case the target is already affected by temporal distortion, its duration will be increased by {3} and damage by {4}% and the newly applied temporal distortion will have the same duration and damage bonus. Damage dealt by this ability ignores shield and {5}% of damage resistance and threshold. This ability cannot critically hit.","Coloca un perjuicio en el objetivo que dura {0} e inflige {1} y {2} de daño cuando expira. En caso de que el objetivo ya esté afectado por distorsión temporal, su duración aumentará en {3} y el daño en {4}%, y la distorsión temporal recién aplicada tendrá la misma duración y bonificación de daño. El daño infligido por esta habilidad ignora el escudo y el {5}% de la resistencia y umbral al daño. Esta habilidad no puede asestar golpes críticos."
temporaldistorsion|psi.k,"Places a debuff on the target that lasts {0} and deals {1} and {2} damage when it expires. In the case the target is already affected by temporal distortion, its damage will be increased by {3}% and the newly applied temporal distortion will have the same duration and damage bonus. Damage dealt by this ability ignores shield and {4}% of damage resistance and threshold. This ability cannot critically hit.","Coloca un perjuicio en el objetivo que dura {0} e inflige {1} y {2} de daño cuando expira. En caso de que el objetivo ya esté afectado por distorsión temporal, su daño aumentará en {3}% y la distorsión temporal recién aplicada tendrá la misma duración y bonificación de daño. El daño infligido por esta habilidad ignora el escudo y el {4}% de la resistencia y umbral al daño. Esta habilidad no puede asestar golpes críticos."
temporaldistorsion|statuseffects.k,"When this effect expires, it will deal {0} and {1} damage to the target. This damage ignores shield and {2}% of damage resistance and threshold.","Cuando este efecto expire, infligirá {0} y {1} de daño al objetivo. Este daño ignora el escudo y el {2}% de la resistencia y umbral al daño."
entropicrecurrence|psi.k,"Repeats {0}% of the last unit of damage taken by the target over {1}. This damage ignores shields and resistances. In cases when the original damage was very slight, the recurrence may actually empower it.","Repite el {0}% de la última unidad de daño recibida por el objetivo durante {1}. Este daño ignora los escudos y las resistencias. En los casos en que el daño original fue muy leve, la recurrencia puede incluso potenciarlo."
entropicrecurrence|statuseffects.k,The character suffers {0} damage every turn. This damage ignores shields and resistances.,El personaje sufre {0} de daño cada turno. Este daño ignora los escudos y las resistencias.
psychotemporaldilation|psi.k,Reduces target's action points by {0} and movement points by {1}. Lasts {2}.,Reduce los puntos de acción del objetivo en {0} y los puntos de movimiento en {1}. Dura {2}.
psychotemporaldilation|statuseffects.k,Action points reduced by {0} and movement points reduced by {1}.,Puntos de acción reducidos en {0} y puntos de movimiento reducidos en {1}.
psychotemporalcontraction|psi.k,"Increases target's action points by {0} and movement points by {1}. Lasts {2}. After the effect ends, there's a {3}% chance of it reversing into a psychotemporal dilation of varying power.","Aumenta los puntos de acción del objetivo en {0} y los puntos de movimiento en {1}. Dura {2}. Después de que el efecto termine, hay un {3}% de probabilidad de que se invierta en una dilatación psicotemporal de potencia variable."
psychotemporalcontraction|statuseffects.k,"Action points increased by {0} and movement points increased by {1}. After the effect ends, there's a {2}% chance of it reversing into a psychotemporal dilation of varying power.","Puntos de acción aumentados en {0} y puntos de movimiento aumentados en {1}. Después de que el efecto termine, hay un {2}% de probabilidad de que se invierta en una dilatación psicotemporal de potencia variable."
limitedtemporalincrement,Reduces all remaining cooldowns by {0}.,Reduce todos los tiempos de reutilización restantes en {0}.
temporaryrewind|psi.k,"Reverses the last damage done to the target, up to maximum of {0} health points. After two turns this health is lost and this may cause the target to die.","Invierte el último daño infligido al objetivo, hasta un máximo de {0} puntos de salud. Después de dos turnos, esta salud se pierde y esto puede provocar la muerte del objetivo."
temporaryrewind|statuseffects.k,"After this effect ends, the character will take {0} damage. This damage ignores shields and resistances.","Después de que este efecto termine, el personaje recibirá {0} de daño. Este daño ignora los escudos y las resistencias."
precognition|psi.k,"While this ability is active, your chance to dodge and evade attacks is increased by {0}% (additively). Drains {1} psi points every turn.","Mientras esta habilidad esté activa, tu probabilidad de esquivar y evadir ataques aumenta en un {0}% (aditivamente). Drena {1} puntos de psi cada turno."
precognition|statuseffects.k,Chance to dodge and evade attacks increased by {0}% (additively). Drains {1} psi points every turn.,Probabilidad de esquivar y evadir ataques aumentada en un {0}% (aditivamente). Drena {1} puntos de psi cada turno.
stasis|psi.k,"Places the target in stasis for {0}, making it immune to all damage and most disabling effects, but also preventing it from acting. While in stasis, the target's status effects will not progress (except the stasis one), but the cooldowns will.","Coloca al objetivo en estasis durante {0}, haciéndolo inmune a todo daño y a la mayoría de los efectos incapacitantes, pero también impidiéndole actuar. Mientras está en estasis, los efectos de estado del objetivo no progresarán (excepto el de estasis), pero sí los tiempos de reutilización."
stasis|statuseffects.k,"Immune to all damage and most disabling effects, but cannot act. The character's status effects do not progress, but the cooldowns do.\n\nThis will expire at the beginning of the last turn of duration instead of at the end.","Inmune a todo daño y a la mayoría de los efectos incapacitantes, pero no puede actuar. Los efectos de estado del personaje no progresan, pero sí los tiempos de reutilización.\n\nEsto expirará al comienzo del último turno de duración en lugar de al final."
psychokineticchain,Links up to {0} enemies into psychokinetic chain which transfers {1}% of all direct mechanical and electrical damage down the chain to the next link as mechanical damage that bypasses energy shields. Maximum total damage transferred from link to link is {2}. The chain lasts {3} or until broken.,Encadena hasta {0} enemigos en una cadena psicoquinética que transfiere el {1}% de todo el daño mecánico y eléctrico directo por la cadena al siguiente eslabón como daño mecánico que ignora los escudos de energía. El daño total máximo transferido de eslabón a eslabón es {2}. La cadena dura {3} o hasta que se rompe.
telekineticgrounding|psi.k,"Immobilizes the target for up to {0}. This ability cannot be resisted, but the victim has a chance to free itself at the end of every turn. This chance starts out small but increases steadily as the telekinetic chains weaken over time. Also, the higher your strength, the easier it is to free yourself.","Inmoviliza al objetivo hasta {0}. Esta habilidad no puede ser resistida, pero la víctima tiene la posibilidad de liberarse al final de cada turno. Esta probabilidad comienza siendo pequeña, pero aumenta constantemente a medida que las cadenas telequinéticas se debilitan con el tiempo. Además, cuanto mayor sea tu fuerza, más fácil será liberarse."
telekineticgrounding|statuseffects.k,"This character is immobilized for now by telekinetic force, but may manage to break free.","Este personaje está inmovilizado por ahora por la fuerza telequinética, pero puede que consiga liberarse."
plasmabeam,"Projects a beam of superheated plasma that intensifies towards its maximum range. It reaches maximum power 2/3 of the way there, where it can deal {0} and {1} damage to anyone in its trajectory.","Proyecta un haz de plasma sobrecalentado que se intensifica hacia su alcance máximo. Alcanza la máxima potencia a 2/3 del camino, donde puede infligir {0} y {1} de daño a cualquiera que se encuentre en su trayectoria."
psychosomaticpredation,"Creates a predatory focus in the invoker against a living enemy, granting {0}% bonus damage to the predator's weapon and unarmed attacks, but reduces the damage of these attacks against everyone else by {1}%. The damage bonus is double if the attack is melee, and again doubled if performed against a frightened enemy. Lasts up to {2}, as long as the predator and prey stay relatively near each other.\n\nIf the predator kills the target with a direct attack, they will regain {3} psi.","Crea un enfoque depredador en el invocador contra un enemigo vivo, otorgando un {0}% de daño adicional a las armas y ataques sin armas del depredador, pero reduce el daño de estos ataques contra todos los demás en un {1}%. La bonificación de daño se duplica si el ataque es cuerpo a cuerpo, y se vuelve a duplicar si se realiza contra un enemigo asustado. Dura hasta {2}, siempre y cuando el depredador y la presa permanezcan relativamente cerca el uno del otro.\n\nSi el depredador mata al objetivo con un ataque directo, recuperará {3} psi."
motorcognitivetransference,"Reduces each of the target's offensive skills base values by up to {0}% (capped at {1}) and then transfers half of this amount to invoker's base skill value or changes the invoker's base skill value to up to {2}% of that of the target (capped at {3}), whichever will yield the higher effective skill. Lasts up to {4}. Only works on humanoids.","Reduce los valores base de cada una de las habilidades ofensivas del objetivo hasta en un {0}% (limitado a {1}) y luego transfiere la mitad de esta cantidad al valor base de habilidad del invocador o cambia el valor base de habilidad del invocador hasta el {2}% del del objetivo (limitado a {3}), lo que resulte en una habilidad efectiva mayor. Dura hasta {4}. Solo funciona en humanoides."
cryogenicbarrier,"Causes shards of ice to be formed from the water taken from the primary target tile that deal {0} and {1} damage to all characters on those tiles. If the tile is traversable and empty, an ice barrier will be left behind that has {2} health and lasts {3} or until destroyed.\n\nTargets that suffer cold damage will also become chilled. Chilled characters have their movement points decreased by {4} for {5}. This effect stacks {6} times.","Hace que se formen esquirlas de hielo a partir del agua tomada de la casilla del objetivo principal que infligen {0} y {1} de daño a todos los personajes en esas casillas. Si la casilla es transitable y está vacía, se dejará una barrera de hielo que tiene {2} de salud y dura {3} o hasta que sea destruida.\n\nLos objetivos que sufren daño por frío también se enfriarán. Los personajes enfriados tienen sus puntos de movimiento disminuidos en {4} durante {5}. Este efecto se acumula {6} veces."
gamerules_caption,Game Rules,Reglas del Juego
gamerules,Set the difficulty and the experience point system for this play-through.,Establece la dificultad y el sistema de puntos de experiencia para esta partida.
easydifficulty_caption,Easy Difficulty,Dificultad Fácil
easydifficulty,"This is for people who find the combat on normal difficulty a bit too hard for their taste.\n\n- Player character has double the normal amount of health, while medical consumables heal for more and have reduced cooldown.\n- Some encounters have been made easier either in enemy numbers or through other means.\n- NPCs will on occasion act less intelligently than on normal difficulty.","Esto es para personas a las que el combate en dificultad normal les resulta un poco difícil para su gusto.\n\n- El personaje jugador tiene el doble de la cantidad normal de salud, mientras que los consumibles médicos curan más y tienen un tiempo de reutilización reducido.\n- Algunos encuentros se han hecho más fáciles, ya sea en número de enemigos o por otros medios.\n- Los PNJ ocasionalmente actuarán con menos inteligencia que en dificultad normal."
normaldifficulty_caption,Normal Difficulty,Dificultad Normal
normaldifficulty,Provides a lot of challenge to an average hardcore gamer with less room for error in combat. This is the way the game is meant to be played.,Proporciona un gran desafío para un jugador hardcore promedio con menos margen de error en combate. Esta es la forma en que se supone que se debe jugar el juego.
harddifficulty_caption,Hard Difficulty,Dificultad Difícil
harddifficulty,"This difficulty is meant for experienced players as it leaves very little room for error.\n\n- Player character has reduced health, while medical consumables heal for less and have increased cooldown.\n- Some encounters have been made harder either in enemy numbers or through other means.\n- NPCs will on occasion act more intelligently than on normal difficulty.\n- Items are sold for 50% of their value.","Esta dificultad está pensada para jugadores experimentados, ya que deja muy poco margen de error.\n\n- El personaje jugador tiene salud reducida, mientras que los consumibles médicos curan menos y tienen un tiempo de reutilización aumentado.\n- Algunos encuentros se han hecho más difíciles, ya sea en número de enemigos o por otros medios.\n- Los PNJ ocasionalmente actuarán con más inteligencia que en dificultad normal.\n- Los objetos se venden por el 50% de su valor."
dominatingdifficulty_caption,DOMINATING Difficulty,Dificultad DOMINANTE
dominatingdifficulty,"This difficulty is for the Underrail veterans that no longer find the game challenging enough.\n\n- In addition to player health and cooldown modifications and additional NPC intelligence, it also increases the regular NPC health by 50% and their skill levels by 30% (this bonus is even greater for certain special ""boss"" NPCs).\n- A lot of encounters have been spiced up with many additional enemies or made extremely hard through other means.\n- Items are sold for 25% of their value.\n\nWe do not guarantee that the game can be completed in this mode so choose at your own peril.","Esta dificultad es para los veteranos de Underrail que ya no encuentran el juego lo suficientemente desafiante.\n\n- Además de las modificaciones de salud y tiempo de reutilización del jugador y la inteligencia adicional de los PNJ, también aumenta la salud normal de los PNJ en un 50% y sus niveles de habilidad en un 30% (esta bonificación es aún mayor para ciertos PNJ especiales ""jefes"").\n- Muchos encuentros se han aderezado con muchos enemigos adicionales o se han vuelto extremadamente difíciles por otros medios.\n- Los objetos se venden por el 25% de su valor.\n\nNo garantizamos que el juego se pueda completar en este modo, así que elige bajo tu propio riesgo."
oddityxp_caption,Oddity XP System,Sistema de PX por Rarezas
oddityxp,"You gain experience up by collecting ""oddities"" scattered across Underrail and by completing quests. Higher end oddities are found in progressively more dangerous and hard to access areas. No experience is granted for skill usage or killing (though some oddities are only dropped by creatures).","Obtienes experiencia recogiendo ""rarezas"" dispersas por Underrail y completando misiones. Las rarezas de nivel superior se encuentran en áreas progresivamente más peligrosas y de difícil acceso. No se otorgan puntos de experiencia por el uso de habilidades o por matar (aunque algunas rarezas solo las dejan caer las criaturas)."
classicxp_caption,Classic XP System,Sistema de PX Clásico
classicxp,"You gain experience by killing enemies, completing quests and utilizing certain skills.","Obtienes experiencia matando enemigos, completando misiones y utilizando ciertas habilidades."
veteran,"You have reached veteran levels and will no longer gain base ability points.\n\nHowever, you'll be able to choose previously unavailable veteran feats, in addition to the standard feats.","Has alcanzado niveles de veterano y ya no obtendrás puntos de habilidad base.\n\nSin embargo, podrás elegir hazañas de veterano previamente no disponibles, además de las hazañas estándar."
specialization,Your character has gained access to specialization points which can be used to improve your feats.,Tu personaje ha obtenido acceso a puntos de especialización que pueden utilizarse para mejorar tus hazañas.
sgs_displayname,South Gate Station,Estación Puerta Sur
sgs_hack_1,5,5
sgs_hack_2,10,10
sgs_hack_3,30,30
gms_hack_1,25,25
aw1_displayname,Warehouse,Almacén
aw1_hack_1,30,30
aw1_hack_2,60,60
rc_warehouse_displayname,Rail Crossing Warehouse,Almacén del Cruce Ferroviario
rc_warehouse_hack_1,50,50
lostvault_displayname,Odis Vault,Bóveda de Odis
lostvault_hack_1,70,70
guns,"Increases your precision and damage with any type of pistol, SMG or rifle. This includes both firearms and energy weapons.\n\nAlso, the higher your skill level the more advanced weapons you can wield effectively.","Aumenta tu precisión y daño con cualquier tipo de pistola, subfusil o rifle. Esto incluye tanto armas de fuego como armas de energía.\n\nAdemás, cuanto mayor sea tu nivel de habilidad, más armas avanzadas podrás empuñar eficazmente."
guns_xpbl,"Increases your precision and damage with any type of pistol, SMG, shotgun, or rifle. This includes both firearms and energy weapons.\n\nAlso, the higher your skill level the more advanced weapons you can wield effectively.","Aumenta tu precisión y daño con cualquier tipo de pistola, subfusil, escopeta o rifle. Esto incluye tanto armas de fuego como armas de energía.\n\nAdemás, cuanto mayor sea tu nivel de habilidad, más armas avanzadas podrás empuñar eficazmente."
guns_xphw,"Increases your precision and damage with any type of pistol, SMG, rifle, or grenade launcher. This includes both firearms and energy weapons.\n\nAlso, the higher your skill level the more advanced weapons you can wield effectively.","Aumenta tu precisión y daño con cualquier tipo de pistola, subfusil, rifle o lanzagranadas. Esto incluye tanto armas de fuego como armas de energía.\n\nAdemás, cuanto mayor sea tu nivel de habilidad, más armas avanzadas podrás empuñar eficazmente."
guns_full,"Increases your precision and damage with any type of pistol, SMG, shotgun, rifle, or grenade launcher. This includes both firearms and energy weapons.\n\nAlso, the higher your skill level the more advanced weapons you can wield effectively.","Aumenta tu precisión y daño con cualquier tipo de pistola, subfusil, escopeta, rifle o lanzagranadas. Esto incluye tanto armas de fuego como armas de energía.\n\nAdemás, cuanto mayor sea tu nivel de habilidad, más armas avanzadas podrás empuñar eficazmente."
heavy guns,"Increases your precision and damage with machine guns and handheld miniguns.\n\nAlso, the higher your skill level the more advanced weapons you can wield effectively.","Aumenta tu precisión y daño con ametralladoras y miniguns portátiles.\n\nAdemás, cuanto mayor sea tu nivel de habilidad, más armas avanzadas podrás empuñar eficazmente."
crossbows,Increases your precision and damage with crossbows.,Aumenta tu precisión y daño con ballestas.
grenades-old,"Allows you to throw grenades more quickly, more often and across greater distance.","Te permite lanzar granadas más rápidamente, con más frecuencia y a mayor distancia."
throwing,"Increases your precision with all thrown weapons and utilities, including grenades.","Aumenta tu precisión con todas las armas y utilidades arrojadizas, incluidas las granadas."
melee,Increases mechanical damage with melee weapons and unarmed attacks and helps you overcome your target's dodge rating.,Aumenta el daño mecánico con armas cuerpo a cuerpo y ataques sin armas y te ayuda a superar la valoración de esquiva de tu objetivo.
