Variable,Original,Translation
shieldarm,Increases the chance to block with shields by {0}% (additive) and the amount blocked by {1}%.,Aumenta la probabilidad de bloqueo con escudos en un {0}% (aditivo) y la cantidad bloqueada en un {1}%.
triggerhappy|feats.k,Initiative increased by {0}.,Iniciativa aumentada en {0}.
triggerhappy|specialization.k,Further increases initiative by {0} for each specialization point.,Aumenta aún más la iniciativa en {0} por cada punto de especialización.
hemopsychosis|feats.k,Grants you an ability that when activated will make all your psi abilities cost health instead of psi until the end of the turn.\n\nCooldown: {0}.,"Te otorga una habilidad que, al activarse, hará que todas tus habilidades psi cuesten salud en lugar de psi hasta el final del turno.\n\nRecarga: {0}."
hemopsychosis|specialabilities.k,When activated will make all your psi abilities cost health instead of psi until the end of the turn.,"Al activarse, hará que todas tus habilidades psi cuesten salud en lugar de psi hasta el final del turno."
hemopsychosis|statuseffects.k,Your psi abilities cost health instead of psi points.,Tus habilidades psi cuestan salud en lugar de puntos psi.
blindsiding|feats.k,Increases unarmed and weapon attack damage by {0}% while in stealth and one turn after exiting stealth.,Aumenta el daño de ataques sin armas y con armas en un {0}% mientras estás en sigilo y un turno después de salir del sigilo.
blindsiding|statuseffects.k,Unarmed and weapon damage increased by {0}%.,Daño sin armas y con armas aumentado en {0}%.
continuumripple,"When your temporal distortion triggers, it has {0}% chance to be applied to each nearby enemy. Distortions that came about in this way can now themselves trigger further distortions.","Cuando se activa tu distorsión temporal, tiene una probabilidad del {0}% de aplicarse a cada enemigo cercano. Las distorsiones que surgen de esta manera ahora pueden desencadenar más distorsiones."
psychotemporalacceleration,Increases action point modification of all psycho-temporal effects by {0} and increases their duration by {1}.,Aumenta la modificación de puntos de acción de todos los efectos psicotemporales en {0} y aumenta su duración en {1}.
futureorientation,"Reduces cooldowns of all temporal manipulation psi abilities that have cooldown by {0}, and increases action point cost for those psi abilities by {1}, providing they have action point cost.","Reduce las recargas de todas las habilidades psi de manipulación temporal que tienen recarga en {0}, y aumenta el coste de puntos de acción para esas habilidades psi en {1}, siempre que tengan coste de puntos de acción."
fend|feats.k,Grants you an ability to immediately gain Spear Guard that can block {0}% more damage than normal for {1}% of the action point cost of a regular attack.\n\nCooldown: {2}.,Te otorga una habilidad para obtener inmediatamente Guardia de Lanza que puede bloquear un {0}% más de daño de lo normal por el {1}% del coste de puntos de acción de un ataque regular.\n\nRecarga: {2}.
fend|specialabilities.k,Instantly grants you Spear Guard status effect that can block {0}% more damage than normal (with current spear and skill {1}).,Otorga instantáneamente el efecto de estado Guardia de Lanza que puede bloquear un {0}% más de daño de lo normal (con la lanza actual y habilidad {1}).
spearguardian|feats.k,Increases the block chance of Spear Guard by {0}%.,Aumenta la probabilidad de bloqueo de Guardia de Lanza en un {0}%.
spearguardian|specialization.k,Increases the block chance bonus by {0}% for each specialization point.,Aumenta la bonificación de probabilidad de bloqueo en un {0}% por cada punto de especialización.
impale|feats.k,Grants you a special attack with the spear that automatically critically hits if it lands.\n\nCooldown: {0}.,Te otorga un ataque especial con la lanza que golpea críticamente de forma automática si impacta.\n\nRecarga: {0}.
impale|specialattacks.k,Perform a special attack with a spear that automatically critically hits if it lands.,Realiza un ataque especial con una lanza que golpea críticamente de forma automática si impacta.
flurry|feats.k,"Grants you an ability to launch {0} consecutive attacks with a sword. Each attack reduces the action point cost of further Flurry activations by {1} action points (this stacks {2} times) until the end of next turn. \n\nIf any of the attacks misses or deals no damage, the flurry will stop and be put on cooldown for {3} and the cost reduction will be removed.","Te otorga una habilidad para lanzar {0} ataques consecutivos con una espada. Cada ataque reduce el coste de puntos de acción de futuras activaciones de Ráfaga en {1} puntos de acción (esto se acumula {2} veces) hasta el final del próximo turno. \n\nSi alguno de los ataques falla o no inflige daño, la ráfaga se detendrá y entrará en recarga durante {3} y se eliminará la reducción de coste."
flurry|specialattacks.k,"Launches {0} consecutive attacks with a sword. Each attack reduces the action point cost of further Flurry activations by {1} action points (this stacks {2} times) until the end of next turn. \n\nIf any of the attacks misses or deals no damage, the flurry will stop and be put on cooldown for {3} and the cost reduction will be removed.","Lanza {0} ataques consecutivos con una espada. Cada ataque reduce el coste de puntos de acción de futuras activaciones de Ráfaga en {1} puntos de acción (esto se acumula {2} veces) hasta el final del próximo turno. \n\nSi alguno de los ataques falla o no inflige daño, la ráfaga se detendrá y entrará en recarga durante {3} y se eliminará la reducción de coste."
flurry|statuseffects.k,Reduces action point cost of Flurry by {0}.,Reduce el coste de puntos de acción de Ráfaga en {0}.
flurry-old|feats.k,"Grants you an ability to launch {0} consecutive attacks with a sword with reduced precision. Each attack reduces the action point cost of further Flurry activations by {1} action points (this stacks {2} times) until the end of next turn. \n\nIf any of the attacks misses or deals no damage, the flurry will stop and be put on cooldown for {3} and the cost reduction will be removed.","Te otorga una habilidad para lanzar {0} ataques consecutivos con una espada con precisión reducida. Cada ataque reduce el coste de puntos de acción de futuras activaciones de Ráfaga en {1} puntos de acción (esto se acumula {2} veces) hasta el final del próximo turno. \n\nSi alguno de los ataques falla o no inflige daño, la ráfaga se detendrá y entrará en recarga durante {3} y se eliminará la reducción de coste."
flurry-old|specialattacks.k,"Launches {0} consecutive attacks with a sword with reduced precision. Each attack reduces the action point cost of further Flurry activations by {1} action points (this stacks {2} times) until the end of next turn. \n\nIf any of the attacks misses or deals no damage, the flurry will stop and be put on cooldown for {3} and the cost reduction will be removed.","Lanza {0} ataques consecutivos con una espada con precisión reducida. Cada ataque reduce el coste de puntos de acción de futuras activaciones de Ráfaga en {1} puntos de acción (esto se acumula {2} veces) hasta el final del próximo turno. \n\nSi alguno de los ataques falla o no inflige daño, la ráfaga se detendrá y entrará en recarga durante {3} y se eliminará la reducción de coste."
spearthrow,"Grants you the ability to throw a spear at the target, dealing {0}%, plus additional {1}% per unit of range, of normal weapon damage. The precision of this attack is dependent on throwing skill. Costs {2} action points.\n\nCooldown: {3}.\n\nYou will usually be able to retrieve the thrown spear afterwards, as it lands nearby the target, at no action point cost.","Te otorga la habilidad de lanzar una lanza al objetivo, infligiendo un {0}%, más un {1}% adicional por unidad de alcance, del daño normal del arma. La precisión de este ataque depende de la habilidad de lanzamiento. Cuesta {2} puntos de acción.\n\nRecarga: {3}.\n\nNormalmente podrás recuperar la lanza lanzada después, ya que aterriza cerca del objetivo, sin coste de puntos de acción."
onslaught|feats.k,Your successful sword attacks increase the damage of further sword attacks by {0}% for {1}. Stacks {2} times. This bonus will be removed if a sword attack misses or does no damage.,Tus ataques exitosos con espada aumentan el daño de futuros ataques con espada en un {0}% durante {1}. Se acumula {2} veces. Esta bonificación se eliminará si un ataque con espada falla o no inflige daño.
onslaught|statuseffects.k,Increases damage done by swords by {0}%. Will be removed if an attack misses or does no damage.,Aumenta el daño infligido por espadas en un {0}%. Se eliminará si un ataque falla o no inflige daño.
decapitate|feats.k,Grants you a special sword attack that deals {0}% of normal weapon damage and can instantly kill a living target if it deals more than {1}% of its remaining health (providing the target has an exposed head).\n\nCooldown: {2}.,Te otorga un ataque especial con espada que inflige un {0}% del daño normal del arma y puede matar instantáneamente a un objetivo vivo si inflige más del {1}% de su salud restante (siempre que el objetivo tenga la cabeza expuesta).\n\nRecarga: {2}.
decapitate|specialattacks.k,Perform a special sword attack that deals {0}% of normal weapon damage and can instantly kill a living target if it deals more than {1}% of its remaining health (providing the target has an exposed head).,Realiza un ataque especial con espada que inflige un {0}% del daño normal del arma y puede matar instantáneamente a un objetivo vivo si inflige más del {1}% de su salud restante (siempre que el objetivo tenga la cabeza expuesta).
riposte|feats.k,"When you block any damage while holding a sword, you can perform a special sword attack with increased chance to hit that deals normal weapon damage at no action point cost.","Cuando bloqueas cualquier daño mientras empuñas una espada, puedes realizar un ataque especial con espada con mayor probabilidad de impacto que inflige daño normal del arma sin coste de puntos de acción."
riposte|specialattacks.k,Perform a special sword attack with increased chance to hit that deals normal weapon damage and costs no action points. Only becomes available after any amount damage is blocked while holding a sword.,Realiza un ataque especial con espada con mayor probabilidad de impacto que inflige daño normal del arma y no cuesta puntos de acción. Solo se activa después de bloquear cualquier cantidad de daño mientras se empuña una espada.
riposte|statuseffects.k,This character can perform a free sword attack.,Este personaje puede realizar un ataque con espada gratuito.
leadingshot|feats.k,Your shotgun attacks ignore {0}% of target's evasion as long as there are no enemies in melee range to disrupt you.,Tus ataques con escopeta ignoran el {0}% de la evasión del objetivo siempre que no haya enemigos a distancia cuerpo a cuerpo para interrumpirte.
leadingshot|specialization.k,Additively increases the amount of evasion ignored by additional {0}% for each specialization point.,Aumenta aditivamente la cantidad de evasión ignorada en un {0}% adicional por cada punto de especialización.
barrelstare,Increases the damage done by your shotgun attacks to targets at close (near-melee) range by {0}%.,Aumenta el daño infligido por tus ataques con escopeta a objetivos a corta distancia (casi cuerpo a cuerpo) en un {0}%.
perfectscattering|feats.k,Each shotgun pellet you fire does additional {0} to {1} points of mechanical damage.,Cada perdigón de escopeta que disparas inflige {0} a {1} puntos de daño mecánico adicional.
perfectscattering|specialization.k,Increases the maximum bonus damage by {0} for each specialization point.,Aumenta el daño adicional máximo en {0} por cada punto de especialización.
fragmentedchaos,Increases critical damage bonus of your shotgun attacks by {0}% divided by number of pellets fired.,Aumenta la bonificación de daño crítico de tus ataques con escopeta en un {0}% dividido por el número de perdigones disparados.
pelletmayhem|feats.k,Your shotgun attacks grant you additional {0}% critical chance for each target you hit for the next shotgun shot.,Tus ataques con escopeta te otorgan un {0}% de probabilidad de crítico adicional por cada objetivo que golpees para el próximo disparo de escopeta.
pelletmayhem|statuseffects.k,Your next shotgun attack will have the critical hit chance increased by {0}%.,Tu próximo ataque con escopeta tendrá la probabilidad de golpe crítico aumentada en un {0}%.
philosophy1,Dipping your feet into philosophy has given you a fresh outlook on life.\n\nIncreases resolve by {0} and maximum psi points by {1}.,Haber incursionado en la filosofía te ha proporcionado una nueva perspectiva de la vida.\n\nAumenta la resolución en {0} y los puntos de psi máximos en {1}.
philosophy2,"You might not be a fully trained philosopher, but you have a good grasp of the essentials.\n\nIncreases resolve by {0} and maximum psi points by {1}.","Puede que no seas un filósofo completamente formado, pero tienes una buena comprensión de lo esencial.\n\nAumenta la resolución en {0} y los puntos de psi máximos en {1}."
philosophy3,You are starting to put the pieces together... There might yet be some meaning behind this wretched existence.\n\nIncreases resolve by {0} and maximum psi points by {1}.,Estás empezando a juntar las piezas... Todavía podría haber algún significado detrás de esta miserable existencia.\n\nAumenta la resolución en {0} y los puntos de psi máximos en {1}.
hightechnicalities,Increases damage done by energy weapons by {0}% for each intelligence point above {1}.,Aumenta el daño infligido por armas de energía en un {0}% por cada punto de inteligencia por encima de {1}.
parry,"While holding a sword or a knife, the character has {0}% plus {1}% per point of dexterity above {2} chance to block a melee attack. The amount blocked is equal to the average base mechanical damage of the current weapon in case of swords and twice that for knives.","Mientras empuña una espada o un cuchillo, el personaje tiene un {0}% más un {1}% por punto de destreza por encima de {2} de probabilidad de bloquear un ataque cuerpo a cuerpo. La cantidad bloqueada es igual al daño mecánico base promedio del arma actual en el caso de las espadas y el doble para los cuchillos."
navalcombat,Increases effective stability by {0}% and maneuverability by {1}% when piloting jet skis. Reduces action point cost of disembarking by {2}. Also increases precision of mounted jet ski weapons for those unproficient with guns.,Aumenta la estabilidad efectiva en un {0}% y la maniobrabilidad en un {1}% al pilotar motos acuáticas. Reduce el coste de puntos de acción de desembarcar en {2}. También aumenta la precisión de las armas de motos acuáticas montadas para aquellos inexpertos con armas de fuego.
improvednavalcombat,Further increases effective stability by {0}% and maneuverability by {1}% when piloting jet skis. Further reduces action point cost of disembarking by {2}. Also increases precision of mounted jet ski weapons for those unproficient with guns.,Aumenta aún más la estabilidad efectiva en un {0}% y la maniobrabilidad en un {1}% al pilotar motos acuáticas. Reduce aún más el coste de puntos de acción de desembarcar en {2}. También aumenta la precisión de las armas de motos acuáticas montadas para aquellos inexpertos con armas de fuego.
jetandjab,"Removes the additional {0}% precision penalty with knife, fist weapon and unarmed attacks when riding jet skis.","Elimina la penalización de precisión adicional del {0}% con ataques de cuchillo, arma de puño y sin armas al montar en motos acuáticas."
navaljousting,Increases damage with spears when riding jet skis by 30%,Aumenta el daño con lanzas al montar en motos acuáticas en un 30%.
seadog,Increases unarmed and weapon damage by {0}% and effective stability and maneuverability by {1}% when attacking from a jet ski.,Aumenta el daño sin armas y con armas en un {0}% y la estabilidad efectiva y la maniobrabilidad en un {1}% al atacar desde una moto acuática.
versatility|feats.k,"Your effective Guns, Crossbows and Melee skill value is brought up to {0}% of the effective value of the highest of those skills.","Tu valor efectivo de habilidad de Armas de Fuego, Ballestas y Cuerpo a Cuerpo se eleva al {0}% del valor efectivo de la más alta de esas habilidades."
versatility|specialization.k,Further increases the percentage of the skill value used by {0}% for each specialization point.,Aumenta aún más el porcentaje del valor de habilidad utilizado en un {0}% por cada punto de especialización.
versatility-xphw,"Your effective Guns, Heavy Guns, Crossbows and Melee skill value is brought up to {0}% of the effective value of the highest of those skills.","Tu valor efectivo de habilidad de Armas de Fuego, Armas Pesadas, Ballestas y Cuerpo a Cuerpo se eleva al {0}% del valor efectivo de la más alta de esas habilidades."
scrutinous,Increases critical chance of unarmed and weapon attacks by {0}%.,Aumenta la probabilidad de crítico de ataques sin armas y con armas en un {0}%.
expertsprint,Sprint now also grants you {0} action points.,Esprintar ahora también te otorga {0} puntos de acción.
increasedbaseability,{0} increased by {1}. This feat increases the base value of {2} and will count towards other feat requirements.,{0} aumentado en {1}. Esta proeza aumenta el valor base de {2} y contará para otros requisitos de proezas.
strider,Increase unstealthed movement points by {0} and out of combat unstealthed movement speed by {1}%.,Aumenta los puntos de movimiento sin sigilo en {0} y la velocidad de movimiento sin sigilo fuera de combate en un {1}%.
ironwill,Increases resolve by {0}%.,Aumenta la resolución en {0}%.
improvedunarmedcombat,Increases unarmed damage by {0}% and gives your unarmed attack {1}% chance to daze the target for {2}.,Aumenta el daño sin armas en un {0}% y otorga a tu ataque sin armas un {1}% de probabilidad de aturdir al objetivo durante {2}.
expertunarmedcombat,Further increases unarmed damage by {0}% and gives your unarmed attack {1}% chance to stun the organic target for {2}.,Aumenta aún más el daño sin armas en un {0}% y otorga a tu ataque sin armas un {1}% de probabilidad de aturdir al objetivo orgánico durante {2}.
empoweredinvocation|feats.k,"Grants you the empowered invocation ability that increases the {0} skill by {1}% until the end of the turn, but drains away all the remaining psi points afterwards.\n\nCooldown: {2}.","Te otorga la habilidad de invocación potenciada que aumenta la habilidad de {0} en un {1}% hasta el final del turno, pero drena todos los puntos psi restantes después.\n\nRecarga: {2}."
empoweredinvocation|specialabilities.k,"When activated increases the {0} skill by {1}% until the end of the turn, but drains away all the remaining psi points afterwards.","Al activarse, aumenta la habilidad de {0} en un {1}% hasta el final del turno, pero drena todos los puntos psi restantes después."
empoweredinvocation|statuseffects.k,"{0} skill increased by {1}%. When this effect expires, the character will lose all psi points.","Habilidad de {0} aumentada en {1}%. Cuando este efecto expira, el personaje perderá todos los puntos psi."
shieldbash|feats.k,Grants you a melee attack that deals mechanical damage equal to {0}%-{1}% of the amount blocked by the carried riot shield and dazes the target for {2}.\n\nCooldown: {3}.,Te otorga un ataque cuerpo a cuerpo que inflige daño mecánico igual al {0}%-{1}% de la cantidad bloqueada por el escudo antidisturbios que llevas y aturde al objetivo durante {2}.\n\nRecarga: {3}.
shieldbash|specialattacks.k,Perform a special attack with your riot shield that deals {0} damage if it lands as well as dazes the target for {1}.,"Realiza un ataque especial con tu escudo antidisturbios que inflige {0} de daño si impacta, además de aturdir al objetivo durante {1}."
boardingup|feats.k,Landing a melee attack while wearing a riot shield increases the amount blocked by the riot shield by {0}% for {1}. Stacks up to {2} times.,Realizar un ataque cuerpo a cuerpo mientras llevas un escudo antidisturbios aumenta la cantidad bloqueada por el escudo antidisturbios en un {0}% durante {1}. Se acumula hasta {2} veces.
boardingup|specialization.k,Increases the block amount by additional {0}% per stack for each specialization point.,Aumenta la cantidad de bloqueo en un {0}% adicional por acumulación por cada punto de especialización.
sweep|feats.k,Grants you a special spear attack with deals {0}% of normal weapon damage to all enemies adjacent to you and puts living targets off balance for {1} if they are hit.\n\nOff-balanced characters have their dodge and evasion reduced to zero.\n\nCooldown: {2}.,Te otorga un ataque especial con lanza que inflige un {0}% del daño normal del arma a todos los enemigos adyacentes a ti y desequilibra a los objetivos vivos durante {1} si son golpeados.\n\nLos personajes desequilibrados tienen su esquiva y evasión reducidas a cero.\n\nRecarga: {2}.
sweep|specialattacks.k,Perform a special spear attack that deals {0}% of normal weapon damage to all enemies adjecent to you and puts living targets off balance for {1} if they are hit.,Realiza un ataque especial con lanza que inflige un {0}% del daño normal del arma a todos los enemigos adyacentes a ti y desequilibra a los objetivos vivos durante {1} si son golpeados.
bodyhorror,"After what you have seen, you'll never look at the fleshly form the same again.\n\nCritical hit chance with weapons and unarmed attacks against humanoids and non-insectoid critters increased by {0}%. Resolve reduced by {1}%.","Después de lo que has visto, nunca volverás a ver la forma carnal de la misma manera.\n\nProbabilidad de golpe crítico con armas y ataques sin armas contra humanoides y criaturas no insectoides aumentada en un {0}%. Resolución reducida en {1}%."
outervisions,"You've seen the wonderous possibilities of the Outer Expanses, both the beautiful and the abominable, and you're now less inclined to believe in the necessity of the limits of this particular physical world.\n\nRange of all psi abilities increased by {0}.","Has visto las maravillosas posibilidades de las Expansiones Exteriores, tanto las hermosas como las abominables, y ahora eres menos propenso a creer en la necesidad de los límites de este mundo físico en particular.\n\nAlcance de todas las habilidades psi aumentado en {0}."
irongrip|feats.k,"Allows you to wield spears in one hand when wearing a suit of armor with a riot shield, but at {0}% penalty to weapon damage.","Te permite empuñar lanzas con una mano cuando llevas una armadura con un escudo antidisturbios, pero con una penalización del {0}% al daño del arma."
irongrip|specialization.k,Reduces the damage penalty by {0}% for each specialization point.,Reduce la penalización de daño en un {0}% por cada punto de especialización.
sixthshell,"Each shotgun shot will grant {0}% bonus damage to shotgun attacks. When stacked up to 5, this damage bonus will change to {1}% and after the sixth attack the bonus will reset.","Cada disparo de escopeta otorgará un {0}% de daño adicional a los ataques de escopeta. Cuando se acumula hasta 5, esta bonificación de daño cambiará a {1}% y después del sexto ataque la bonificación se restablecerá."
forcefullinnervation,"You conditioned your mind for psionic powers the raw way and it left its mark on you. You use your Will base ability instead of Intelligence to determine the number of psi slots, but your max psi points are reduced by {0}.\n\nYou obtained the rare golden pill that might undo this, but you are not sure if you should use it.","Has condicionado tu mente para los poderes psiónicos por la vía bruta y ha dejado su marca en ti. Usas tu habilidad base de Voluntad en lugar de Inteligencia para determinar el número de ranuras psi, pero tus puntos psi máximos se reducen en {0}.\n\nHas obtenido la rara píldora dorada que podría deshacer esto, pero no estás seguro de si deberías usarla."
psychoneuraloptimization|feats.k,"While having only one psi school innervated, the psi cost of all abilities is reduced by {0}%.","Mientras tengas solo una escuela psi innervada, el coste psi de todas las habilidades se reduce en un {0}%."
psychoneuraloptimization|specialization.k,Further reduces the psi cost by {0}% for each specialization point.,Reduce aún más el coste psi en un {0}% por cada punto de especialización.
psychoneuralflexibility,One psi school is ignored when determining the multi-school innervation psi cost penalty.,Se ignora una escuela psi al determinar la penalización de coste psi por innervación multiescuela.
expandedpsicapacitance|feats.k,Psi reserves increased by {0}%.,Reservas psi aumentadas en {0}%.
expandedpsicapacitance|specialization.k,Psi reserves bonus further increased by {0}% for each specialization point.,Bonificación de reservas psi aumentada aún más en {0}% por cada punto de especialización.
tattooprotectorate,"At ease, Corporal.\n\nIncreases health by {0}%.","Descansa, Cabo.\n\nAumenta la salud en {0}%."
tattoojkk,You are one tactful operative.\n\nIncreases persuasion skill by {0}.,Eres un agente operativo con mucho tacto.\n\nAumenta la habilidad de persuasión en {0}.
tattooanarchy,You bow to no authority.\n\nIncreases chance to critically hit with weapon and unarmed attacks by {0}%.,No te doblegas ante ninguna autoridad.\n\nAumenta la probabilidad de golpear críticamente con ataques con armas y sin armas en un {0}%.
